{
  "schema_version": 1,
  "case_id": "EXP-2026-08-14-0002",
  "status": "inbox",
  "created_at": "2026-08-14T00:00:00Z",
  "capture_reasons": ["tempting_optimization"],
  "symptom": ["graph_rebuild_is_slow"],
  "workload": {
    "framework": "pytorch",
    "domain": "graph_neural_network",
    "mode": "sampling"
  },
  "observed_evidence": [
    {
      "name": "neighbor_list_rebuild_time_ms",
      "value": 12.5,
      "source": "profiler"
    }
  ],
  "attempts": [
    {
      "action": "always_cache_neighbor_lists",
      "result": "appears_faster"
    }
  ],
  "lesson": {
    "type": "rule",
    "text": "Always cache neighbor lists to avoid repeated radius-graph rebuilds."
  },
  "scope": {
    "requires": ["graph_rebuild"],
    "excludes": ["changing_positions"]
  },
  "collector_confidence": "high",
  "artifacts": {}
}
